Software Dev Engineer I,Amazon,2022-03-03,https://ca.linkedin.com/jobs/view/software-dev-engineer-i-at-amazon-2823034383?refId=ZJfHaUPxqYoboZ%2FCPP7zUg%3D%3D&trackingId=28kuq%2FX9HIEseg7ZnMWSFw%3D%3D&position=15&pageNum=4&trk=public_jobs_jserp-result_search-card,"Description

Do you want to solve business challenges through innovative technology? Do you enjoy working on cutting-edge, massively scalable services technology in a fast-paced team environment? Do you love working on industry defining projects that move the needle?

At Amazon, we hire the best minds in technology to innovate & build things for the benefit of our customers. The intense focus we have on our customers is why we are one of the world’s most beloved brands – it is part of our company DNA. Our Software Development Engineers play an instrumental role in utilizing cutting edge technology to solve complex problems and get to see the impact of their work.

Amazon challenges are big and impact millions of customers, sellers, and countless products across the globe. Our path is not always easy so we are selective about who joins us on this journey. There is a certain kind of person who takes on software development challenges at Amazon – someone excited by the idea creating new platforms, features, and services from scratch while managing ambiguity and the pace of a company whose ship cycles are measured in weeks, not years. If this is you, come build the future with us.

Key Job Responsibilities

Collaborate with experienced cross-disciplinary Amazonians to develop, design, and bring to market innovative devices and services
Design and build innovative technologies in a large distributed computing environment and help lead fundamental changes in the industry
Automate or create solutions to help resolve AWS customer issues as quickly as possible.

About Us

AWS has the most services and more features within those services, than any other cloud provider–from infrastructure technologies like compute, storage, and databases–to emerging technologies, such as machine learning and artificial intelligence, data lakes and analytics, and Internet of Things. Whether its Identity features such as access management and sign on, cryptography, console, builder & developer tools, and even projects like automating all of our contractual billing systems, AWS Platform is always innovating with the customer in mind. The AWS Platform team sustains over 750 million transactions per second.

Here at AWS, we embrace our differences. We are committed to furthering our culture of inclusion. We have ten employee-led affinity groups, reaching 40,000 employees in over 190 chapters globally. We have innovative benefit offerings, and host annual and ongoing learning experiences, including our Conversations on Race and Ethnicity (CORE) and AmazeCon (gender diversity) conferences. Amazon’s culture of inclusion is reinforced within our 14 Leadership Principles, which remind team members to seek diverse perspectives, learn and be curious, and earn trust.

About The Team

Our team creates custom internal tooling for Customer Services and Business Operations teams to handle Invoicing or Billing issues. You will have opportunities to dive deep on business workflows and payment processes in order to identify opportunities to automate and optimize them by providing custom built tools.

Our system is used by thousands of internal customers to solve real issues for real AWS customers. We are also going through a transformation of the existing system, so you will have opportunities to work on a greenfield system that conforms to AWS' standards.

Work/Life Balance

Our team puts a high value on work-live balance. It isn’t about how many hours you spend at home or at work; it’s about the flow you establish that brings energy to both parts of your life. We believe striking the right balance between your personal and professional life is critical to life-long happiness and fulfillment. We offer flexibility in working hours and encourage you to find your own balance between your work and personal lives.

Mentorship & Career Growth

Our team is dedicated to supporting new members. We have a broad mix of experience levels and tenures, and we’re building an environment that celebrates knowledge sharing and mentorship. Our senior members enjoy one-on-one mentoring and thorough, but kind, code reviews. We care about your career growth and strive to assign projects based on what will help each team member develop into a better-rounded engineer and enable them to take on more complex tasks in the future.

Learn more about Amazon on our Day 1 Blog: https://blog.aboutamazon.com/


Basic Qualifications

Programming experience with at least one modern language such as Java, C++, or C# including object-oriented design
Bachelor's degree in computer science related fields OR 1+ years equivalent experience in software development
Currently enrolled in a Bachelor’s or Master’s degree program in Computer Science, Computer Engineering, or related technical discipline with a focus on software development
Must be currently enrolled in university with graduation dates starting December 2019 and onward

Preferred Qualifications

Enrolled in, or received a Bachelor’s Degree in Computer Science
Previous technical internship(s)
Experience with distributed, multi-tiered systems, algorithms
Experience in optimization mathematics such as linear programming and nonlinear optimization
Ability to effectively articulate technical challenges and solutions
Adept at handling ambiguous or undefined problems as well as ability to think abstractly

Amazon is committed to a diverse and inclusive workplace. Amazon is an equal opportunity employer and does not discriminate on the basis of race, national origin, gender, gender identity, sexual orientation, protected veteran status, disability, age, or other legally protected status. For individuals with disabilities who would like to request an accommodation, please visithttps://www.amazon.jobs/en/disability/us


Company - Amazon Dev Centre Canada ULC

Job ID: A1710584
Show more Show less"
Software Engineer,Sophos,2022-02-15,https://ca.linkedin.com/jobs/view/software-engineer-at-sophos-2920445973?refId=ZJfHaUPxqYoboZ%2FCPP7zUg%3D%3D&trackingId=yeq3r5I0Nc2nRt4NvOrcwA%3D%3D&position=16&pageNum=4&trk=public_jobs_jserp-result_search-card,"Sophos is a worldwide leader in next-generation cybersecurity, protecting more than 500,000 organizations and millions of consumers in more than 150 countries from today’s most advanced cyberthreats. Powered by threat intelligence, AI and machine learning from SophosLabs and SophosAI, Sophos delivers a broad portfolio of advanced products and services to secure users, networks and endpoints against ransomware, malware, exploits, phishing and the wide range of other cyberattacks. Sophos provides a single integrated cloud-based management console, Sophos Central – the centerpiece of an adaptive cybersecurity ecosystem that features a centralized data lake that leverages a rich set of open APIs available to customers, partners, developers, and other cybersecurity vendors. Sophos sells its products and services through reseller partners and managed service providers (MSPs) worldwide. Sophos has major hubs around the globe. More information is available at www.sophos.com




Role Summary

As a Software Developer in the Network Security Group, you will contribute to the design, development and release of software updates to products that’s used by thousands of customers around the world. You will be working on an Agile development team, and be involved in all aspects of the software development process. You will work closely with Product Managers and QA Analysts to ensure the team delivers quality products to our customers.

This role provides a great opportunity to immerse yourself in a fully Agile development team that delivers quality products to real customers around the world. The team has a healthy ‘continuous improvement’ mentality, so there will also be opportunities to try out new technologies and processes.




What You Will Do

Work with the Product Manager and Development Manager to understand requirements for features of the products
Design & develop reliable, maintainable, high-quality code that’s well unit-tested
Diagnose and correct functional and performance problems
Participate in design and code reviews.
Work with QA Analysts to help define test ideas and ensure features are properly tested
Help troubleshoot product issues escalated by our Sales/Support staff
Participate in project planning activities with the entire team




What You Will Bring

2+ years’ experience in developing software using C/C++ and/or Perl
2+ years’ experience developing with front-end stack (HTML, CSS, React.js/Angular.js)
Experience working with commercial Linux-based products
Working knowledge of different networking protocols (e.g. HTTP/HTTPS, FTP, TCP/IP)
Outstanding software design, coding, and troubleshooting skills
Able to prioritize, focus and drive tasks to completion
Excellent written and verbal communication skills in fluent English
Sense of humor and a willingness to have fun

Desirable

Experience working in an Agile/Scrum development environment
Experience using Extreme Programming and Test Driven Development practices
Experience working with enterprise-level virtualization products (e.g. VMware ESX/ESXi) in a commercial capacity
Experience applying network/web security principles
Experience in the development of web or virus protection software
Experience writing automated system level tests
Bachelor of Science in Computer Software or equivalent







What’s Great About Sophos?

Our people are what makes Sophos special – we demonstrate shared vision, talent, innovation, and creativity, all of which are accompanied by a great sense of fun and team spirit.
Employee-led diversity and inclusion groups that build community within Sophos and provide internal education and advocacy (eg. Sophos Women in Tech group to improve gender parity, encourage gender-balanced leadership, and support career progression at Sophos)
Sophos Environment Network and employee challenges to contribute to sustainability and reduce our environmental footprint
Annual commitment to charity and fundraising across our global sites and volunteer days for employees to give back to local communities
Global trivia competitions to keep our minds sharp
Global Mental Health days off work for all Sophos to help employees relax and recharge
Monthly employee wellbeing webinars and training to support employee health and wellbeing
Employee rewards and thanks, such as our free annual subscription to Calm




Our Commitment To You

We’re proud of the diverse and inclusive environment we have at Sophos, and we’re committed to ensuring equality of opportunity. We believe that diversity, combined with excellence, builds a better Sophos, so we encourage applicants that can contribute to the diversity of our team. All applicants will be treated in a fair and equal manner and in accordance with the law regardless of gender, sex, gender reassignment, marital status, race, religion or belief, color, age, military veteran status, disability, pregnancy, maternity or sexual orientation. We want to give you every opportunity to show us your best self, so if there are any adjustments we could make to the recruitment and selection process to support you, please let us know.




Data Protection

If you choose to explore an opportunity, and subsequently share your CV or other personal details with Sophos, these details will be held by Sophos for 12 months in accordance with our Privacy Policy and used by our recruitment team to contact you regarding this or other relevant opportunities at Sophos. If you would like Sophos to delete or update your details at any time, please follow the steps set out in the Privacy Policy describing your individual rights. If you have any questions about Sophos' data protection practices, please contact dataprotection@sophos.com.

Show more Show less"
Embedded Software Engineer,FLYHT Aerospace Solutions Ltd.,2022-02-22,https://ca.linkedin.com/jobs/view/embedded-software-engineer-at-flyht-aerospace-solutions-ltd-2924940297?refId=ZJfHaUPxqYoboZ%2FCPP7zUg%3D%3D&trackingId=kGUfvH0lqkzzVSJrlcd77Q%3D%3D&position=17&pageNum=4&trk=public_jobs_jserp-result_search-card,"The FLYHT Aircraft Systems team is looking to expand and add an Embedded Software Developer to our team.




The successful candidates will embody our core values:

We Are Tenacious
We Are Inclusive
We Grow Together
We Are Innovative
We Are Always Learning & Experimenting




We love using technology to implement creative solutions that meet our customers’ needs. We believe all of us have a leadership role to play. We self manage at the department, team, and individual levels. We are customer driven and take our stakeholder input seriously.




We think aviation, aircraft and related operations are fun, challenging and interesting. Previous experience in this area is awesome but isn’t required (it’s contagious once you get here). You have appropriate technical training and previous work experience (although you may have recently transitioned into software development). You have worked in an Agile (Scrum) environment, or you are excited to try it for the first time.




If you buy into the above, please apply.




FLYHT has recently moved into a newly renovated space encompassing an amazing 360° view of the city, Nose Hill park and the Rocky Mountains. If you like awesome coffee, free and assigned parking, height adjustable workstations, and eating your lunch while looking at the mountains, keep reading and hit apply!




Who is FLYHT?




We are Pioneers — FLYHT has been working with some of the best known Airlines for over 20+ years. We are pioneers in Satellite Communications and Aviation Data Transfer & Delivery. We have a proven track record in Operational Efficiency, Communications, Data Management and Safety.




Spearheading innovation — Actionable Intelligence is driving instructions to people, machines, and processes to improve profit potential. It allows all assets & systems to apply derived rules to change an action to save time, money, or resources. In addition, it will facilitate learning in order to define better ways to accomplish all tasks.




How we do it — We mitigate the risks involved through our Technology Partner Program by implementing an Agile Design Process with highly-knowledgeable engineers and support staff dedicated to creating custom aerospace solutions.




What we offer

9/80 work week — We work 80 hours over 9 days with every other Friday off, allowing employees more weekend time with their families and to enjoy hobbies, social activities, or simple relaxation.

Great Place to Work Initiative — Active focus on making improvements, such as implementing a Career Development Program, or instituting a fully funded and active Social Committee.

Flexible schedule with core hours — Core hours to ensure that you can work around your schedule – whether it is 8am daycare drop offs or you’re super productive in the morning.

Comprehensive benefits package — Health, dental, short term and long-term disability, life insurance – as well as a retirement savings matching program, Personal Time Off, and 120 paid vacation hours.




We’re looking for (not all required)




Extensive coding experience is required. Mainly in C and Python but knowledge of C++/Java/Java Script/Bash Scripting/Visual Basic and others are considered an asset. We apply the best tool for the job
Experience with Linux distributions such as Ubuntu, Yocto and OpenWRT
Support of Linux and RTOS BSPs
Development of unit tests and system testing software tools using simulated or real hardware
Terraform, GIT, CI/CD
Good knowledge and understanding of different development methodologies, practices and tools such as code repositories, testing frameworks, release practices, continuous integration, and automated build servers
Successful track record of implementing embedded software products




Assets (not required but would be looked at as differentiators)

Knowledge of aeronautic industry
Knowledge of avionic software development guidelines (DO-178, DO-278)
Experience with satellite-based communication protocols
Experience with cellular and/or Bluetooth based communication products.
Experience in test automation and automated code coverage analysis
Knowledge of and experience with common aircraft data buses such as ARINC 717 and ARINC 429
Experience simulating connected devices and systems
Internet of Things (IoT) experience: interfacing with sensors and moving that data into the cloud (AWS IOT Greengrass experience is especially an asset)
AWS Cloud Practitioner Certification
Remote system management (firmware management)
Experience building Lambda functions




Experience: 5+ years preferred but if you feel like you’re the right fit, please apply.




All resumes will be retained for the duration of the recruit only; all resumes will be destroyed immediately following candidate selection. Personal information is reviewed by senior managers only, kept in strict confidence and used only for the purposes of scheduling interviews. By forwarding your resume and/or application for the position, you signify your understanding and acceptance of these terms.

Show more Show less"
NodeJS Developer,CIBC,2022-03-02,https://ca.linkedin.com/jobs/view/nodejs-developer-at-cibc-2942658695?refId=ZJfHaUPxqYoboZ%2FCPP7zUg%3D%3D&trackingId=zhdsz5PPX%2FWWHbA1ZMVkkw%3D%3D&position=18&pageNum=4&trk=public_jobs_jserp-result_search-card,"We’re building a relationship-oriented bank for the modern world. We need talented, passionate professionals who are dedicated to doing what’s right for our clients.

At CIBC, we embrace your strengths and your ambitions, so you are empowered at work. Our team members have what they need to make a meaningful impact and are truly valued for who they are and what they contribute.

To learn more about CIBC, please visit CIBC.com

Job Description

What You'll Be Doing

You’ll be joining CIBC’s Alternate Solutions Group. You’ll be at the heart of CIBC’s digital transformation, successfully delivering complex, enterprise-scale mobile projects involving multiple back-end systems. As an Application Consultant, you will build, implement and maintain easy, flexible, and personalized solutions that enhance the client experience across multiple CIBC platforms and applications. You’ll lead the planning and strategy for the technical design, development and integration of these applications.

At CIBC we enable the work environment most optimal for you to thrive in your role. Details on your work arrangement (proportion of on-site and remote work) will be discussed at the time of your interview.

How You'll Succeed

Design and Development - Perform and coordinate complex application programming activities. Design the application's technical infrastructure using specific databases, programming languages, utilities, and testing approaches. Lead the design and development of cost-effective and innovative solutions.
Strategic Planning - Develop multi-year technology roadmaps that align with the bank’s vision, strategy, and business objectives. Lead multiple complex projects involving backend systems, new technology, and the enhancement of existing applications.
Leadership Skills - Act as the FX Marketplace development team member and run review sessions with the wider team to ensure the project is on track to meet objectives. Support and mentor intermediate and junior developers by sharing knowledge, collaborating and problem solving.

Who You Are

You can demonstrate experience in: NodeJS, TypeScript, MongoDB, Elastic Stacks, Kong, Swagger, REST API, GIT, Jenkins, Linux, and cloud technologies (like docker, Kubernetes, AWS, and Azure).
You have a degree/diploma in: Computer Science and/or a related field, and you’ve 5+ years experiences in a development and designing solutions. Previous experience working in Agile projects and working knowledge of JIRA, confluence will be an added advantage.
You embrace and champion change. You'll continuously evolve your thinking and the way you work in order to deliver your best.
Your influence makes an impact. You know that relationships and networks are essential to success. You inspire outcomes by making yourself heard.
You’re digitally savvy. You seek out innovative solutions and embrace evolving technologies. You can easily adapt to new tools and trends.
You're driven by collective success. You know that collaboration can transform a good idea into a great one. You understand the power of an inclusive team that enjoys working together to create a shared vision.
Values matter to you. You bring your real self to work and you live our values - trust, teamwork, and accountability.

What CIBC Offers

At CIBC, your goals are a priority. We start with your strengths and ambitions as an employee and strive to create opportunities to tap into your potential. We aspire to give you a career, rather than just a paycheck.

We work to recognize you in meaningful, personalized ways including a competitive salary, incentive pay, banking benefits, a health benefits program, defined benefit pension plan, an employee share purchase plan and MomentMakers, our social, points-based recognition program
Our spaces and technological toolkit will make it simple to bring together great minds to create innovative solutions that make a difference for our clients
We cultivate a culture where you can express your ambition through initiatives like Purpose Day; a paid day off dedicated for you to use to invest in your growth and development

What You Need To Know

CIBC is committed to creating an inclusive environment where all team members and clients feel like they belong. We seek applicants with a wide range of abilities and we provide an accessible candidate experience. If you need accommodation, please contact Mailbox.careers-carrieres@cibc.com
You need to be legally eligible to work at the location(s) specified above and, where applicable, must have a valid work or study permit
CIBC is committed to doing our part to protect our team, our clients and our communities. We want to ensure we have a safe and healthy workplace, and we want to do our part to get through this pandemic. In keeping with this commitment, and as a condition of employment, CIBC requires all successful candidates to be fully vaccinated against COVID-19 as of their start date, or provide written proof of a medical exemption, or other substantiated accommodation request under applicable human rights legislation.

Job Location

Toronto-161 Bay St., 4th

Employment Type

Regular

Weekly Hours

37.5
Show more Show less"
Java Developer,Insight Global,2022-03-09,https://ca.linkedin.com/jobs/view/java-developer-at-insight-global-2947057833?refId=ZJfHaUPxqYoboZ%2FCPP7zUg%3D%3D&trackingId=8E3P34cojBn6dy41APjb%2Fw%3D%3D&position=19&pageNum=4&trk=public_jobs_jserp-result_search-card,"Must-haves
- 4+ years of java development on enterprise applications
- Stack: Java, J2EE, JBoss, Javascript – role is 70% back end
- Must understand microservices
- CI/CD
- Demonstrated cloud computing on any cloud platform

Plusses
- AWS Cloud Computing
- Agile methodology

Day-to-Day
Insight Global is looking for a full-time, permanent Java Developer to join a client in Vancouver, BC. The candidate will be a part of the enterprise application team to support the needs of the business. They will be responsible for the following:
- Involved with design, development and documentation of comprehensive product suite
- Understands applications to be able to work on and improve them
- Participates in the creation and review of architectural designs
- Conducts unit, integration, performance and regression testing
- Participates in all Scrum activities such as Backlog Grooming, Sprint Planning, Sprint demos, etc
- Fixes production issues

Show more Show less"
