Software Engineer I/II,Microsoft,2022-02-23,https://ca.linkedin.com/jobs/view/software-engineer-i-ii-at-microsoft-2930126954?refId=cG62y8PNpSL47tmGQT9nxA%3D%3D&trackingId=TBi0lnVw4Nv4J4LQJwYgIA%3D%3D&position=1&pageNum=3&trk=public_jobs_jserp-result_search-card,"Microsoft is on a mission to empower every person and every organization on the planet to achieve more. Our culture is centered on embracing a growth mindset, a theme of inspiring excellence, and encouraging teams and leaders to bring their best each day. In doing so, we create life-changing innovations that impact billions of lives around the world. You can help us to achieve our mission.

Responsibilities

We value people who can bring a diverse perspective to our product and where a developer will not just write code, but will have a real meaningful impact on the direction of the product and which features to build. We are building a team where diversity of thought and background is valued as strongly as technical skills, and where everyone is encouraged to come up with new ideas to make our customers’ lives better.

We are looking for talented early to mid-career Software Engineers to help us deliver highly scalable services and world-class product experiences. You will have opportunities to work on multiple layers of the technology stack, ranging from customer-focused user experience work, building scalable distributed cloud services, working with big data, machine learning, and everything in between. You will learn how to design services and experiences that are required to work around the globe. You will collaborate with team members and other engineering groups in Microsoft to build full stack web applications and services using the latest web technologies in a dynamic and agile environment. You will be part of a fun-loving, diverse team that seeks challenges, loves learning and values teamwork. You will have opportunities for mentorship, career growth, and work on high-business impact areas.

By applying to this position, you are being considered for multiple like positions within our organization for an invitation-only Virtual Interview Day on Wednesday, April 6th 2022. Position specifics, including hiring team, location and position details will be determined following the interview process.

Qualifications

Required Qualifications:

2+ years of experience with one or more general purpose programming languages including but not limited to: Java, C/C++, C#, Python
BS in Computer Science or related technical field experience

Preferred Qualifications

Experience running and working on services at scale
Experience in developing, debugging and maintaining code in object oriented languages and database querying languages
Strong coding, debugging, algorithm design and problem solving skills

May Include: Ability to meet Microsoft, customer and/or government security screening requirements. These requirements include but are not limited to the following specialized security screenings:

Microsoft Cloud Background Check: This position will be required to pass the Microsoft Cloud background check upon hire/transfer and every two years thereafter.

Microsoft is an equal opportunity employer. All qualified applicants will receive consideration for employment without regard to age, ancestry, color, family or medical care leave, gender identity or expression, genetic information, marital status, medical condition, national origin, physical or mental disability, political affiliation, protected veteran status, race, religion, sex (including pregnancy), sexual orientation, or any other characteristic protected by applicable laws, regulations and ordinances. We also consider qualified applicants regardless of criminal histories, consistent with legal requirements. If you need assistance and/or a reasonable accommodation due to a disability during the application or the recruiting process, please send a request via the Accommodation request form.

Benefits/perks listed below may vary depending on the nature of your employment with Microsoft and the country where you work.
Show more Show less"
Software Development Engineer,Mastercard,2022-03-04,https://ca.linkedin.com/jobs/view/software-development-engineer-at-mastercard-2916583397?refId=cG62y8PNpSL47tmGQT9nxA%3D%3D&trackingId=ul1%2F129i3ZX8PqGHFalQUg%3D%3D&position=2&pageNum=3&trk=public_jobs_jserp-result_search-card,"Our Purpose

We work to connect and power an inclusive, digital economy that benefits everyone, everywhere by making transactions safe, simple, smart and accessible. Using secure data and networks, partnerships and passion, our innovations and solutions help individuals, financial institutions, governments and businesses realize their greatest potential. Our decency quotient, or DQ, drives our culture and everything we do inside and outside of our company. We cultivate a culture of inclusion for all employees that respects their individual strengths, views, and experiences. We believe that our differences enable us to be a better team – one that makes better decisions, drives innovation and delivers better business results.

Job Title

Software Development Engineer

Who is Mastercard?

Mastercard is a global technology company in the payments sector. We power payments and provide products and services for individuals and industries all around the world. Our people, technology, data and brand provide the capabilities that drive our success. We believe in connecting people to priceless possibilities.

As a company, we know that our success is driven by the skills, experience, integrity and mindset of the talent we hire. By building an inclusive, world-class culture, our employees have once-in-a-career opportunities to be a part of teams that have a greater impact on our community and our world. We invite you to join our team to find out how you too can start something priceless.

Overview

Mastercard’s Cyber and Intelligence Solutions organization develops and delivers world-class security products and services for customers across the globe. NuData Security predicts fraudulent transactions by identifying good users from bad, based on their online behaviour. By analyzing over 38 billion behaviours annually, NuData harnesses the power of behavioural and biometric analysis to empower its clients to predict fraud and verify the user behind the device. This allows clients to predict fraud before a critical decision, reduce customer insult, and investigate bad actors efficiently.

We are looking for a talented and passionate Software Development Engineer to join our team in our Vancouver office. Internally, this role is referred to as ‘Senior Software Engineer’.

Are you happiest when you’re taking all the pieces and making them work together without a hitch with rock-solid code?
Do you like to work on the products which prevents identity theft and make our transactions secured?


Role

You will be a key member of our team, which is responsible for increasing service stability, adding application insights, enhancing deployment processes, and improving our products.

Implement solutions that solve complicated challenges around performance, scaling, and security while instrumenting services to provide high quality insight into emerging issues
Design and develop applications, system to system interfaces and complete software solutions, perform vendor-related activities, and create documentation such as user guides and software development guides
Refine and enhance the development process used within our teams to drive improvements to development efficiency
As a developer, you will manage your own time when accomplishing project goals and are encouraged to grow your skills with continual learning, workshops, conferences, and talks. Leadership is technical, meetings are short
As an operator, you will manage colonies of servers across multiple environments and regions, deploying updates, migrating databases, and architecting self-healing infinitely scaling services


All About You

A qualified candidate is desired to show proficiency in the following key areas (not limited to):

Demonstrated software development experience in a professional development setting
Java experience, or experience with at least one object-oriented language such as Java, C#, C++, Python, or Scala with some prior experience with Java
Knowledge of testing frameworks and source control systems
Experience designing, developing, and implementing scalable and resilient restful API services
Experience with building and managing software packages and/or server images
Experience in managing servers, networks, and infrastructure with broad knowledge of the following: Linux, networking, servers, virtualization, security, availability, resiliency, redundancy, alerting, and monitoring
Familiarity with building scalable distributed data processing and visualization tools
Strong problem solving, algorithm design, and complexity analysis skills
Exceptional communication, both written and spoken


Helpful To Have

Experience writing documentation and creating diagrams
Experience working with cloud-based server environments
Experience with AWS services such as EC2, S3, RDS, Kinesis, SQS, SNS, etc. or other cloud providers
Familiarity with infrastructure as code tools such as CloudFormation or Terraform
Familiarity with DevOps tools such as Packer, Vagrant, Vault, and Consul
Familiarity with monitoring tools such as Graphite, Influx, Statsd, Kibana and Logstash
Familiarity with databases, such as Redis, Cassandra, Elasticsearch, MySQL, or Postgres
Bachelor of Computer Science, equivalent degree or equivalent work experience
An interest in fraud detection and security


In return we offer a hybrid work environment based out of the Vancouver Mastercard Tech Hub including work from anywhere for weeks as per Mastercard policy.

We also offer beautiful view of the North Shore mountains, coffee that doesn’t stink, and colleagues that are as brilliant as they are likeable. We do cool things as a company, like summer kayaking, game nights, and monthly craft beer tastings. Don’t forget the competitive salary, extended health benefits, flex-time schedules, and encouragement and support for professional development. We love it here, and we think you will too.

COVID-19 Considerations

We value the safety of each member of our community because we know we’re all in this together. In many locations, which may change over time, we’ve implemented a virtual hiring process and continue to interview candidates by video or phone. In addition, in some locations, only individuals who have been fully vaccinated will be permitted inside Mastercard offices until further notice.

In the US, Mastercard is a government contractor, which may legally require most Mastercard employees to be vaccinated unless a verified approved medical or religious exemption is granted. Further, we are currently making every effort towards having employees return to work in the office 2 days per week, if that makes sense for their team. Everyone must be vaccinated to enter Mastercard offices at this time. Therefore, we expect all candidates to be vaccinated or to be approved for a medical or religious accommodation prior to commencing work at Mastercard.

About Mastercard

In the US, Mastercard is an inclusive Equal Employment Opportunity employer that considers applicants without regard to gender, gender identity, sexual orientation, race, ethnicity, disabled or veteran status, or any other characteristic protected by law.

If you require accommodations or assistance to complete the online application process, please contact reasonable_accommodation@mastercard.com and identify the type of accommodation or assistance you are requesting. Do not include any medical or health information in this email. The Reasonable Accommodations team will respond to your email promptly.

Corporate Security Responsibility

Responsibilities

All activities involving access to Mastercard assets, information, and networks comes with an inherent risk to the organization and, therefore, it is expected that every person working for, or on behalf of, Mastercard is responsible for information security and must

Abide by Mastercard’s security policies and practices;
Ensure the confidentiality and integrity of the information being accessed;
Report any suspected information security violation or breach, and
Complete all periodic mandatory security trainings in accordance with Mastercard’s guidelines.
Show more Show less"
Software Engineer I/II,Microsoft,2022-03-03,https://ca.linkedin.com/jobs/view/software-engineer-i-ii-at-microsoft-2881738770?refId=cG62y8PNpSL47tmGQT9nxA%3D%3D&trackingId=dQzKeK90%2FxCxMfQPAVvXFA%3D%3D&position=3&pageNum=3&trk=public_jobs_jserp-result_search-card,"Microsoft is on a mission to empower every person and every organization on the planet to achieve more. Our culture is centered on embracing a growth mindset, a theme of inspiring excellence, and encouraging teams and leaders to bring their best each day. In doing so, we create life-changing innovations that impact billions of lives around the world. You can help us to achieve our mission.

Responsibilities

We value people who can bring a diverse perspective to our product and where a developer will not just write code, but will have a real meaningful impact on the direction of the product and which features to build. We are building a team where diversity of thought and background is valued as strongly as technical skills, and where everyone is encouraged to come up with new ideas to make our customers’ lives better.

We are looking for talented early to mid-career Software Engineers to help us deliver highly scalable services and world-class product experiences. You will have opportunities to work on multiple layers of the technology stack, ranging from customer-focused user experience work, building scalable distributed cloud services, working with big data, machine learning, and everything in between. You will learn how to design services and experiences that are required to work around the globe. You will collaborate with team members and other engineering groups in Microsoft to build full stack web applications and services using the latest web technologies in a dynamic and agile environment. You will be part of a fun-loving, diverse team that seeks challenges, loves learning and values teamwork. You will have opportunities for mentorship, career growth, and work on high-business impact areas.

By applying to this position, you are being considered for multiple like positions within our organization for an invitation-only Virtual Interview Day on Friday, March 25th 2022. Position specifics, including hiring team, location and position details will be determined following the interview process.

Qualifications

Required Qualifications:

2+ years of experience with one or more general purpose programming languages including but not limited to: Java, C/C++, C#, Python
BS in Computer Science or related technical field experience

Preferred Qualifications

Experience running and working on services at scale
Experience in developing, debugging and maintaining code in object oriented languages and database querying languages
Strong coding, debugging, algorithm design and problem solving skills

May Include: Ability to meet Microsoft, customer and/or government security screening requirements. These requirements include but are not limited to the following specialized security screenings:

Microsoft Cloud Background Check: This position will be required to pass the Microsoft Cloud background check upon hire/transfer and every two years thereafter.

Microsoft is an equal opportunity employer. All qualified applicants will receive consideration for employment without regard to age, ancestry, color, family or medical care leave, gender identity or expression, genetic information, marital status, medical condition, national origin, physical or mental disability, political affiliation, protected veteran status, race, religion, sex (including pregnancy), sexual orientation, or any other characteristic protected by applicable laws, regulations and ordinances. We also consider qualified applicants regardless of criminal histories, consistent with legal requirements. If you need assistance and/or a reasonable accommodation due to a disability during the application or the recruiting process, please send a request via the Accommodation request form.

Benefits/perks listed below may vary depending on the nature of your employment with Microsoft and the country where you work.
Show more Show less"
Back End Developer / DevOps Engineer,RoofBundle,2022-02-14,https://ca.linkedin.com/jobs/view/back-end-developer-devops-engineer-at-roofbundle-2921217601?refId=cG62y8PNpSL47tmGQT9nxA%3D%3D&trackingId=dzcaBmNdCOnjFTF1vNgtXw%3D%3D&position=4&pageNum=3&trk=public_jobs_jserp-result_search-card,"Backend Developer / DevOps Engineer




Who are we:

RoofBundle is a rapidly growing venture backed tech startup disrupting the construction industry in North America. Our mobile software helps roofing contractors increase their profits by automating the quoting process and making it easier to organize and keep track of multiple jobs. The company was established in January 2021, and is led by our founder David, with the support of a small passionate team. Our team is made up of problem solvers and self-starters, who are all energized by fast-paced work and can adjust their footing swiftly on any given day. 







Our Story:

Our founder, David Peters, was an experienced roofing contractor for over a decade. After years of spending evenings and weekends manually creating quotes and bill of materials he saw an opportunity to reduce this time consuming process by creating a mobile app. The mobile app has an embedded calculation engine that allows roofers to input roofing dimensions while they are on the roof and based on these dimensions, the app will create a professional quote, a bill of materials and labour requirements within minutes. The app is also an organizational tool that can be used to track current and historical projects and upload before/after photos. Essentially, the time savings that roofing companies will get from using this app will improve the profitability of each job and also allow them to scale their business because they will have more time to actually install roofs.







We are looking for a Backend Developer / DevOps Engineer to join our collaborative team who will have an immediate impact on a young, fast growing startup company. We need someone that can help grow our business by crafting and iterating Roofbundle’s back-end real time architecture and technologies that power Roofbundle. Daily activities will include writing complex back-end code, developing and maintaining platform components that enable our core product features, and closely working with other developers to ensure quality of delivered software.







What will you be responsible for:




Work within a cross-functional team of software developers, with an embedded product manager and designer to bring the product vision to life.
Work as part of an agile team, build cloud-based application, microservices and solutions on AWS.
Working with CTO to optimize and scale the performance of our systems.
Develop improvement, upgrade, and maintain stability through monitoring, diagnostic capabilities, troubleshooting issues and conducting root-cause analysis.
Participate in the ownership of services, including on-call duties and incident management




We want someone to join us who is fully committed to our vision and sees this role as an exciting adventure.







Who are we looking for:




You are excited about making an impact with your talent through the use of technology
Strong technical engineering skills with at least 5 years of experience in NodeJs, Python, Java, .Net, C++ or similar object-oriented language
Proficient in RESTful API, MongoDB and/or relational DB.
Solid software engineering fundamentals: data structure, design pattern.
At least 1 years of experience with cloud computing technologies, building, automating, deploying applications, and provisioning infrastructure in AWS infrastructure (EC2, IAM, S3), including CI/CD workflows and tools, such as Jenkins, Code Deploy (AWS) and GitHub.
Experience with Test-Driven Development, full software development lifecycle and delivery using Agile practices.
Familiar with Web development including HTML, CSS, Javascript, React, JSON
Excellent communication and teamwork skills.
Passion for personal development and professional growth
Ambition and drive to build a global company




As we grow, we expect you to take on a leadership role and lead a team of engineers, so an ambition to lead and manage is great.







Preferences:




Administer and troubleshoot Linux based systems
Knowledge of IP networking, VPN’s, DNS, load balancing and firewall.
Experience with monitoring and log aggregating frameworks such as AWS CloudWatch/X-Ray.
Knowledge of security and configurations, including OWASP.







Our success is your success

We are a venture backed start-up with global ambitions. As a Backend Developer / DevOps Engineer you will have equity, so our success is your success. Come transform the construction industry with us!

Show more Show less"
