"Developer, Cloud Engineering",Bell,2022-02-23,https://ca.linkedin.com/jobs/view/developer-cloud-engineering-at-bell-2933259479?refId=fsxuzB8RymfaP9%2BqvzeINg%3D%3D&trackingId=wQaNeUOrEKOsqZ7vUxg9fg%3D%3D&position=13&pageNum=1&trk=public_jobs_jserp-result_search-card,"Req Id: 344032

At Bell, we do more than build world-class networks, develop innovative services and create original multiplatform media content – we advance how Canadians connect with each other and the world.

If you’re ready to bring game-changing ideas to life and join a community that values, professional growth and employee wellness, we want you on the Bell team.

Bell is making unmatched investments in our world-leading broadband fibre and wireless networks because we know they’re the backbone of the products and services our customers love. If you’re excited about transforming the way people connect, our Network team is the right place for you.

Are you ready to grow your career by taking on a new role at Bell? We always look for qualified internal applicants within our own team to support their development.

Bell is making unmatched investments in our world-leading broadband fibre and wireless networks because we know they’re the backbone of the products and services our customers love. If you’re excited about transforming the way people connect, our Network team is the right place for you.

The Network Cloud - Network & Security team is responsible to build, develop, automate and operate Bell network infrastructure of the data centers, and to integrate an end-to-end connectivity for the services hosted on our virtual environment, such as OpenStack, VMWare, GCP and AWS.

Job Duties/Accountabilities

Implement, support and improve appropriate network and automation solutions to support the Network Cloud requirements.
Provide support for day-to-day operations and incidents relate to the network.
Design, test and deliver the network functions with production quality
Implement solutions to provide end-to-end connectivity for complex service requirements
Actively participate to implement DevOps concepts.
Define requirements and specifications with internal groups in an Agile setting (Epics and User Stories)
Participate to the technology development; contribute to the strategy and evolution of existing services, as well as future architecture evolution around communication platforms.
Requires to be on call and to perform off hours work.

Critical Qualifications/Competencies

BS Degree in Engineering, Computer Science or Information Science
3-5 years of technical or operation experience in network or IT
Very good knowledge of F5 load balancing technology
Knowledge of Networking (BGP, ISIS, Segment Routing, EVPN, MPLS, …)
Have working experience with the following vendor technologies: Cisco, Juniper, F5, PaloAlto, Fortinet
Strong interpersonal, oral and written communication skills, with a good sense of humour
Team player who always put the interest of the team above all other priorities
Strong aptitude to recognize opportunities for improvement in day-to-day work and take appropriate actions
Excellent analytical, problem solving and decision making skills with a strong attention to details
Strong time management skills and work ethic (highly motivated) to manage multiple projects/accountabilities

Preferred Qualifications/Competencies

Expertise in software development and application development with Python and Ansible.
Agile / DevOps / Lean / Six Sigma experience
Experience in building network infrastructure
Network certifications , CCNA, CCNP and CCNE
Knowledge of Linux
Knowledge of OpenStack
Bilingual (French/English)

#Engineering #ComputerScience #Tech #Technical #Networking #Cisco #Juniper #Arista #Fortinet #Paloalto #VMWare #CCNP #CCIE #PaloAlto #Fortinet #Linux #Ansible #DevOps #SixSigma

Bilingualism is an asset (English and French); adequate knowledge of French is required for positions in Quebec.

Additional Information

Position Type: Management

Job Status: Regular - Full Time

Job Location: Canada : Ontario : Mississauga || Canada : Ontario : London || Canada : Ontario : North Bay || Canada : Ontario : Ottawa || Canada : Ontario : Sudbury || Canada : Ontario : Toronto || Canada : Ontario : Waterloo || Canada : Quebec : Montreal

Flexible work profile: Mobile

Application Deadline: 03/14/2022

Please apply directly online to be considered for this role. Applications through email will not be accepted.

At Bell, we don’t just accept difference - we celebrate it. We’re committed to fostering an inclusive, equitable, and accessible workplace where every team member feels valued, respected, and supported, and has the opportunity to reach their full potential. We welcome and encourage applications from people with disabilities.

Accommodations are available on request for candidates taking part in all aspects of the selection process. For a confidential inquiry, simply email your recruiter directly or recruitment@bell.ca to make arrangements. If you have questions regarding accessible employment at Bell please email our Diversity & Inclusion Team at inclusion@bell.ca.

Created: Canada, QC, Montreal

Bell, one of Canada's Top 100 Employers.

344032
Show more Show less"
Big Data Developer,iClanz Inc,2022-03-04,https://ca.linkedin.com/jobs/view/big-data-developer-at-iclanz-inc-2952178403?refId=fsxuzB8RymfaP9%2BqvzeINg%3D%3D&trackingId=oXllKrPeaHY6hss8ty0yHA%3D%3D&position=14&pageNum=1&trk=public_jobs_jserp-result_search-card,"Big Data Engineer

Toronto/ Mississauga, CN/ Jersey City, NJ

Long Term

 

Qualifications :

·        8+ years of software development experience in Big Data technologies (Spark/Hive/Hadoop)

·         Experience in working on Hadoop Distribution, good understanding of core concepts and best practices

·         Good experience in building/tuning Spark pipelines in Scala/Python

·         Good experience in writing complex Hive queries to derive business critical insights

·         Good Programming experience with Java/Python/Scala

·         Experience with AWS Cloud, exposure to Lambda/EMR/Kinesis will be good to have

·         Experience in NoSQL Technologies - MongoDB, Dynamo DB

 

Roles and Responsibilities :

·         Design and implement solutions for problems arising out of large-scale data processing

·         Attend/drive various architectural, design and status calls with multiple stakeholders

·         Ensure end-to-end ownership of all tasks being aligned

·         Design, build & maintain efficient, reusable & reliable code

·         Test implementation, troubleshoot & correct problems

·         Capable of working as an individual contributor and within team too

·         Ensure high quality software development with complete documentation and traceability

·         Fulfil organizational responsibilities (sharing knowledge & experience with other teams/ groups)

·         Conduct technical training(s)/session(s), write whitepapers/case studies/blogs etc.

 

 send resume to kevin@iclanz.com

Show more Show less"
"Senior Back End Developer, Cloud Admin",Atlassian,2022-03-03,https://ca.linkedin.com/jobs/view/senior-back-end-developer-cloud-admin-at-atlassian-2939746309?refId=fsxuzB8RymfaP9%2BqvzeINg%3D%3D&trackingId=caOnGeh%2F8Ph26JU6jqvxkQ%3D%3D&position=15&pageNum=1&trk=public_jobs_jserp-result_search-card,"Atlassian can hire people in any country where we have a legal entity, assuming candidates have eligible working rights and a sufficient timezone overlap with their team. As our offices re-open, Atlassians can choose to work remotely or return to an office, unless it’s necessary for the role to be performed in the office. Interviews and onboarding are conducted virtually, a part of being a distributed-first company.

Atlassian is looking for a senior backend software engineer to join our Cloud Administration team. You’ll be joining a team focused on building features for our enterprise-scale customers to enable better governance, trust, and security. Our team has a direct impact on the growth of Atlassian and is the proud owner of the Atlassian Access product. We are enabling cross-product experiences, and are committed to removing all blockers for the adoption of the cloud for enterprise customers.

More about you

As a senior engineer on this team, you will work with a talented team of Product Managers, Designers, and Architects to build application-layer services encompassing backend development, monitoring, scaling, and optimizing to make the administration of Atlassian products simple at an Enterprise scale.

Y

ou will be empowered to drive innovation by coming up with new and exciting ideas to creatively solve issues, as well as actively look for opportunities to improve the design, interface, and architecture of Atlassian's products on the cloud.

On your first day, we'll expect you to have :

Bachelor's degree in Engineering, Computer Science, or equivalent
5+ years of experience crafting and implementing highly scalable and performant RESTful micro-services
Proficiency in any modern object-oriented programming language (e.g., Java, Scala, Python, Javascript, etc.)
Fluency in any one database technology (e.g. RDBMS like Oracle or Postgres and/or NoSQL like DynamoDB or Cassandra)
Solid understanding of distributed systems and application security
Real passion for collaboration and strong interpersonal and communication skills
Broad knowledge and understanding of SaaS, PaaS, IaaS industry with hands-on experience of public cloud offerings (AWS, GAE, Azure)
Familiarity with cloud architecture patterns and an engineering discipline to produce software with quality


It’s Great, But Not Required If You Have

Experience using AWS, Kubernetes, and Docker containers
Familiarity with GraphQL, web application development, and JavaScript frameworks (React, JQuery, Angular)


More About Our Benefits

Whether you work in an office or a distributed team, Atlassian is highly collaborative and yes, fun! To support you at work (and play) we offer some fantastic perks: ample time off to relax and recharge, flexible working options, five paid volunteer days a year for your favourite cause, an annual allowance to support your learning & growth, unique ShipIt days, a company paid trip after five years and lots more.

More About Atlassian

Creating software that empowers everyone from small startups to the who’s who of tech is why we’re here. We build tools like Jira, Confluence, Bitbucket, and Trello to help teams across the world become more nimble, creative, and aligned—collaboration is the heart of every product we dream of at Atlassian. From Amsterdam and Austin, to Sydney and San Francisco, we’re looking for people who want to write the future and who believe that we can accomplish so much more together than apart. At Atlassian, we’re committed to an environment where everyone has the autonomy and freedom to thrive, as well as the support of like-minded colleagues who are motivated by a common goal to: Unleash the potential of every team .

Additional Information

We believe that the unique contributions of all Atlassians is the driver of our success. To make sure that our products and culture continue to incorporate everyone's perspectives and experience we never discriminate on the basis of race, religion, national origin, gender identity or expression, sexual orientation, age, or marital, veteran, or disability status.

All your information will be kept confidential according to EEO guidelines.

If your experience looks a little different from what we’ve identified and you think you can rock the role, we’d love to learn more about you.

Learn more about Atlassian’s culture, interviewing flow, and hiring process by checking out our Candidate Resource Hub .
Show more Show less"
Backend Developer (remote),TelosTouch,2022-03-09,https://ca.linkedin.com/jobs/view/backend-developer-remote-at-telostouch-2962362819?refId=fsxuzB8RymfaP9%2BqvzeINg%3D%3D&trackingId=BZ4cKMulpLDEQ5ThKKtbsA%3D%3D&position=16&pageNum=1&trk=public_jobs_jserp-result_search-card,"Why TelosTouch

TelosTouch is a Client Experience platform that converts key moments to meaningful results. With our TouchPoint technology, financial institutions increase the quality and frequency of client engagement to easily recommend the right solution, acquire new business and intervene in a timely manner.

Our clients include some of the world's largest financial institutions and we are growing quickly.

If you are looking to be part of a great team that is bringing clients and financial institutions closer together, we would love to talk to you.

Requirements

Role

Build features that span the stack, NodeJS, React, SQL, Redis, AWS, Docker, Ansible while collaborating with designers, engineers, and product
Contribute to the development of large-scale projects within an agile process, ensuring robust and lasting solutions are implemented
Work with the engineering team to develop customized digital solutions where applicable
Embed automated testing tools within deployment models to increase quality of deployments
Develop relevant technical and how-to documentation to support DevOps processes (ie: pipeline configuration, logic, components)
Create deployment pipelines for applications
Lead individual project priorities, deadlines, and deliverables
Identify and resolve performance and scalability issues
Build and maintain unit and integration tests
Collaborate with Product and Design to ensure the specifications make sense
Participate in Sprint rituals like planning, grooming, and retrospective
Partner with the product team to remain current on DevOps tooling, processes and deployment patterns
Adopt and Promote Engineering Transformation goals, methodologies and practices
Participate in agile projects / initiatives following SCRUM and/or KANBAN frameworks


Requirements

Minimum 5+ years of development experience (Backend/DevOps)
Solid understanding of Object Oriented and/or Functional Programming
Experienced with back-end technologies like NodeJS, Python, Ruby, etc.
Exposure and/or interest in Cloud (AWS, GCP, Azure)
Good knowledge of algorithms, design principles/patterns, and componentization approaches (Docker, Kubernetes)
Good understanding on asynchronous programming
Analytical thinking and problem solving skills


Why you?

Our 4 core principles resonate with you

Delivering on our commitments: You are results-oriented and thrive on exceeding targets
Debating then committing: You can work with cross-functional partners to evolve dynamically
Obsessing about our clients: You bring a solution mindset to work to transform clients’ lives
Leading together: You believe that none of us is smarter than all of us


Benefits

Like-minded people working on worthy goals
Inclusive and respectful workplace
Knowledge share and mentorship
Competitive compensation package, including stock options
Leading edge hardware and software
Employee benefits program, including health and dental insurance
Team and skill-building activities
A great creative office in the downtown Toronto core (when the world opens up)


You can view our job openings and apply here: https://telostouch.applytojobs.ca/

TelosTouch is an equal opportunity employer committed to diversity and inclusion. We are pleased to consider all qualified applicants for employment without regard to race, color, religion, sex, sexual orientation, gender identity, national origin, age, disability, protected veterans’ status, Aboriginal/Native American status or any other legally protected factors. Disability-related accommodations are available upon request during the application process, in accordance with the Ontario Human Rights Code and the Accessibility for Ontarians with Disabilities Act.
Show more Show less"
Associate Software Engineer,Scotiabank,2022-02-25,https://ca.linkedin.com/jobs/view/associate-software-engineer-at-scotiabank-2939992493?refId=fsxuzB8RymfaP9%2BqvzeINg%3D%3D&trackingId=0mROw7Ir6kn%2BO6BNAR%2FozA%3D%3D&position=17&pageNum=1&trk=public_jobs_jserp-result_search-card,"Requisition ID: 142774

Join a purpose driven winning team, committed to results, in an inclusive and high-performing culture.

The Team

The Associate Software Engineer is responsible for providing specialized technical design/programming in the analysis, development, implementation, and support. The incumbent is responsible for current and future implementation projects within the group, introducing new technologies to meet business objectives and providing technical consultation and guidance to all development projects.

To join our team, you must be proactive and dynamic, demonstrate initiative, willing to learn and have an eagerness to learn web deployment and financial instruments, thrive on challenge and be a team player.

The Role

Executive Offices (E.O.) Finance System and Support is a part of Scotiabank’s Information Technology & Solutions (IT&S), and they primarily support the Bank’s multi-functional financial Enterprise Resource Planning (ERP) suite. The suite includes project financials, purchasing and accounting modules with automated process workflow. The integrated database supports accounting reports and diverse MIS. The suite has 1,000 users and this user community is diversified and spans across the Bank’s divisions.

Reporting to the Senior Technical Manager, E.O. Finance System and Support, the Lead Programmer Analyst is responsible for providing specialized technical leadership in the analysis, design, development, implementation, and support, including system design and network analysis. Also responsible for current and future implementation projects within the group, introducing new technologies to meet business objectives and providing technical consultation and guidance to all development projects.

Some Of The Key Accountabilities Include

Migrate/Support different Web programming technology, SQL database and ETL applications projects from Windows 2008 and SQL2008 to latest environment.
Work with areas in the Scotiabank Group to deliver efficient Enterprise suite applications and reporting solutions
Design, development, implementation and support all related Enterprise applications and reporting solutions.
Assist Project Forecasting Module, Business Analysts, Control/Analyst, Finance, Taxation, IT&S clients in how technology can be applied to solve problems in creative ways.
Assist Senior Manager in the research, design, development and integration of Enterprise applications and reporting tools and strategies
In addition to strong structure-programming in SQL store procedure, Web Server, NTFS Security, ETL, web programming and completed development cycle, and Microsoft suite, the incumbent should have excellent problem solving and analytical skills, willing to learn Project Forecasting Module, Financial, and Taxation Industry modules.

Analyze User Requirements

Support Enterprise Applications and related information delivery tools
Possess a sound systems development expertise, particularly in the area of reporting, data mining and data dissemination. He/she must remain current with available technologies by researching tools (software and hardware) that can be used to improve and accelerate the production of report and data extracts
Responsible for ensuring that ad-hoc requests for end users are provided efficiently and in a timely manner.
Participate in system analysis and design, coding, user acceptance test, implementation, production support, and both technical and non-technical documentation
Design, develop and integrate solutions
Operation Documentation

What You Will Bring To Succeed

Strong Team Player, must be reliable, pro-active, results-oriented, customer-focused and attentive to details
2-3 years experience and solid of structure programing in Web development, HTML, CSS, JavaScript, ASP.Net
2+ years experience and solid of structure programing in relational database and multi-relational database such as Microsoft Network, Security, Servers (Setup), MS SQL/store procedure, BCP command, PowerShell, MDX, Microsoft SSIS, SSRS, SFTP scripting, Microsoft Analysis (SSAS), Oracle SQL scripting/command line.
1+ years experiences with Microsoft Sql server (DBA, Multidimensional Database), IIS server, and windows server configuration, setup and security.
1+ year experience and knowledge of MS Power-BI (Financial DAX measurement), SFTP Server (Reflection for Secure IT Server), SharePoint Online/Office 365, Power Automate (PowerApps and Flow), Cloud Technology, MS IIS Server and Cloud Concept, AZURE DevOps.
Knowledge of Smartstream (INFOR.) application or related financial system (Project, assets, Payment, Purchasing, GLs) backend structure databases.
Knowledge of systems analysis and requirements definition
Knowledge of the Bank’s financial systems technical infrastructure
Capable of multi-tasking and managing concurrent tasks and initiatives

The Workplace

We are technology partners who help the business transform how our employees around the world work
We have an inclusive and collaborative working environment that encourages creativity, curiosity, and celebrates success!
You'll get to work with and learn from diverse industry leaders, who have hailed from top technology companies around the world
We foster an environment of innovation and continuous learning
We care about our people, allowing them to design how they work to deliver amazing results
We offer a competitive total rewards package, including a performance bonus, company matching programs (on pension & profit sharing), and generous vacation

Scotiabank

As Canada's International Bank, we are a diverse and global team. We speak more than 100 languages with backgrounds from more than 120 countries. We value the unique skills and experiences everyone brings to the Bank and are committed to creating and maintaining an inclusive and accessible environment for everyone. If you require accommodation (including, but not limited to, an accessible interview site, alternate format documents, ASL Interpreter, or Assistive Technology) during the recruitment and selection process, please let our Recruitment team know. Candidates must apply directly online to be considered for this role. We thank all applicants for their interest in a career at Scotiabank; however, only those candidates who are selected for an interview will be contacted.

Is this Role not the Exact fit?

Sign up to stay in touch; we’ll let you know when we have new positions on the team.

Location(s): Canada : Ontario : Toronto

Scotiabank is a leading bank in the Americas. Guided by our purpose: ""for every future"", we help our customers, their families and their communities achieve success through a broad range of advice, products and services, including personal and commercial banking, wealth management and private banking, corporate and investment banking, and capital markets.

At Scotiabank, we value the unique skills and experiences each individual brings to the Bank, and are committed to creating and maintaining an inclusive and accessible environment for everyone. If you require accommodation (including, but not limited to, an accessible interview site, alternate format documents, ASL Interpreter, or Assistive Technology) during the recruitment and selection process, please let our Recruitment team know. If you require technical assistance, please click here. Candidates must apply directly online to be considered for this role. We thank all applicants for their interest in a career at Scotiabank; however, only those candidates who are selected for an interview will be contacted.
Show more Show less"
